{"schema":"alchemy.autobuild.integration/0.2","package":{"name":"ed209_rto2_grid_gopher_sphere","version":"0.4","kind":"oorexx"},"working_directory":".","environment":{"set":{},"prepend_path":[]},"tests":[{"name":"sphere-structure","argv":["python3","-m","unittest","discover","-s","tests","-v"],"timeout_seconds":60}],"publish":{"tree":{"source":".","path":"spheres/ed209_rto2_grid_gopher_sphere_v0.4"}}}
