{
  "environment": {
    "prepend_path": [],
    "set": {}
  },
  "package": {
    "kind": "oorexx",
    "name": "oorexx_memory_fabric_xtp",
    "version": "0.1-candidate1"
  },
  "publish": {
    "tree": {
      "path": "packages/oorexx_memory_fabric_xtp_v0.1_candidate1",
      "source": "."
    }
  },
  "schema": "alchemy.autobuild.integration/0.2",
  "tests": [
    {
      "argv": [
        "sha256sum",
        "--check",
        "SHA256SUMS"
      ],
      "name": "source-manifest-sha256",
      "timeout_seconds": 30
    },
    {
      "argv": [
        "bash",
        "-n",
        "tests/run.sh",
        "tests/xtp_wire_loopback.sh"
      ],
      "name": "shell-script-syntax",
      "timeout_seconds": 30
    }
  ],
  "working_directory": "."
}
