{
  "schema": "alchemy.autobuild.integration/0.2",
  "package": {
    "name": "shannon_env_probe",
    "version": "0.1",
    "kind": "shell"
  },
  "working_directory": ".",
  "environment": {
    "set": {
      "SHANNON_ROOT": "/home/hc3/alchemy/ourladyair_shannon_v0.5"
    },
    "prepend_path": []
  },
  "tests": [
    {
      "name": "inspect-shannon-environment-contract",
      "argv": ["sh", "run_tests.sh"],
      "timeout_seconds": 60
    }
  ],
  "publish": {
    "artifact_only": true
  }
}
